source,rating,text,date,author,date_parsed
Google,5,A great place to go for the events. It's great to have a new and modern stadium. Now if only the Nets were any good ...,12/30/2025 01:46:28,Andreas Schulmeyer,2025-12-30 01:46:28
Google,4,"Die Arena ist modern und sauber und leicht mit der U-Bahn zuerreichen. Wir waren für ein Nets Spiel dort. Nimmt man den Eingang der auf dem Ticket steht, kommt man unkompliziert in die Arena. Die Preise für die Getränke sind hoch. Ein großes Getränk reicht für zwei Personen.",12/29/2025 08:18:17,Der Welcher,2025-12-29 08:18:17
Google,5,Great place to watch basketball.,12/26/2025 22:26:24,Denise Goodnow,2025-12-26 22:26:24
Google,5,"Kažu da neke kafane nisu samo zidovi, stolovi i stolice.
One su priče. Uspomene. Glasovi.
Neka mesta postanu deo tebe — a Vinovlačara je bila baš to.",12/26/2025 15:04:52,Lazar Ciric,2025-12-26 15:04:52
Google,5,"Great experience, come on Brooklyn!",12/25/2025 21:30:28,Sebastián Mena P.,2025-12-25 21:30:28
Google,5,Wish I can go every event in the building,12/25/2025 19:46:18,Nathaniel Britton,2025-12-25 19:46:18
Google,4,"This arena is great, the building is fantastic and you feel like youre really ""in"" the game, easy sight lines, and overall a great show. The concessions were a bit mid, however. The staff serving them were fine, but the food itself were bland, for example the boneless chicken wings were chewy and way over sauced. Prices were fine.

Would definitely see another game or concert here, though.",12/25/2025 18:32:17,Ray Morrell,2025-12-25 18:32:17
Google,5,A vibe you can't get anywhere else!,12/25/2025 17:18:13,james williams,2025-12-25 17:18:13
Google,5,Nets aren't in playoff contention,12/25/2025 17:01:26,nathsn,2025-12-25 17:01:26
Google,5,The Nets suck but at least the tickets were cheap.,12/25/2025 16:04:38,Doruk Toklu,2025-12-25 16:04:38
Google,5,Was a great experience except for the expensive Meal,12/24/2025 20:43:19,Tobias Toney,2025-12-24 20:43:19
Google,1,"I dont think was smart for them at this location. Its just too much and ruined Brooklyn NY
But otherwise its here what can you say",12/24/2025 12:50:35,Ether Shakur,2025-12-24 12:50:35
Google,5,Great venue. We watched jonas brothers perform. It was mesmerizing,12/24/2025 03:39:35,Uma Prasad,2025-12-24 03:39:35
Google,2,"It's a dirty,  unorganized staffed Arena 🫤 it's NYC area dammit ☝!  it should be the best ☝️shame, very disappointed !  The Jonas Brothers was awesome 👌 👏",12/23/2025 23:12:47,capricornyc,2025-12-23 23:12:47
Google,3,While entrance into the Barclays was easy fast and painless. The Everest like climb to our seats wasn’t. We sat on what seemed to be about as big as a deck of cards. The ushers and staff were super friendly. But I’ll try to buy floor level next time.,12/23/2025 16:49:05,bernard heffern,2025-12-23 16:49:05
Google,5,Quick and easy to enter and get to your seats. It’s so effective getting fans in and out the stadium.,12/23/2025 13:27:23,LaKeitha Walton,2025-12-23 13:27:23
Google,5,Great venue for NBA basketball.,12/23/2025 09:19:25,Father Mike,2025-12-23 09:19:25
Google,5,"Modernes Stadion mit Top-Stimmung während dem Basketballspiel!
Ich komme wieder, wenn ich das nächste mal in New York bin.",12/23/2025 08:52:15,Fabio Ratte,2025-12-23 08:52:15
Google,3,Okay for games and concerts. Extremely steep seating in the upper sections that are hazardous. Women’s bathrooms or at least the one right by sections 114 and 115 had 5 stalls and 20 urinals altogether. Bizarre and inefficient.,12/23/2025 07:11:14,N H,2025-12-23 07:11:14
Google,4,"Easy entry, right next to a subway station, and a great view of the Nets' court compared to Madison Square Garden for a fraction of the price.",12/22/2025 04:10:04,Marianne Paige,2025-12-22 04:10:04
Google,5,Brooklyn Nets vs. Toronto Raptors,12/22/2025 02:53:51,Martina Bräutigam,2025-12-22 02:53:51
Google,5,"great, close to the station",12/21/2025 21:55:57,heidy,2025-12-21 21:55:57
Google,5,"Incroyable match de NBA, en revanche toutes les boissons/eau sont jetées à l’entrée ainsi que briquets etc. Bières cheres (17$ la canette sans tips)",12/21/2025 18:12:52,Julie Beauvais,2025-12-21 18:12:52
Google,4,"We had a great time as a family.
Lots of food options.
Good music.
Overall Entertaining.
Parking $50 of you don’t find anything on the street.",12/21/2025 04:50:28,MemoriesBy Mia,2025-12-21 04:50:28
Google,3,"The place is nice, however, sometimes I feel like the staff doesn’t know the rules. I came here once for a concert and they didn’t know the rules about what cameras and what devices I could bring. But this place is a local place so it does feel like a local little venue.",12/21/2025 04:17:36,Cassandra,2025-12-21 04:17:36
Google,5,Fuimos a un partido de los brooklyn neta y el ambiente fue espectacular,12/20/2025 23:25:34,jorge,2025-12-20 23:25:34
Google,4,"Barclays Center feels like one of those places where Brooklyn shows its real scale and energy. It sits right in the middle of movement — subways below, traffic around, people coming from every direction. There’s always a sense that something is happening here, even when there’s no event inside.
The building itself is heavy and solid, with a modern, almost industrial look that fits Brooklyn well. It doesn’t try to be elegant or flashy — it feels strong, urban, and purposeful. When there’s a game or a concert, the whole area comes alive: crowds gather, voices mix, lights reflect off the streets, and the pace of the neighborhood shifts.
Inside, everything is organized for large events — sports, concerts, shows. The sound, the scale, and the flow of people all remind you that this is one of the main gathering points of the city. But even outside, just standing near the entrance, you can feel the energy moving through the area.
Barclays Center isn’t just an arena.
It’s a pulse point for Brooklyn — where transit, crowds, noise, and city life all meet in one place.",12/20/2025 04:41:56,Roman Petrovskii,2025-12-20 04:41:56
Google,4,Fun place to be for more than the game,12/19/2025 23:54:04,KX Whyknot,2025-12-19 23:54:04
Google,5,"Wir hatten eine gute Anreise.
Direkt an der U-Bahn gelegen.
Schnelle koordinierte Abfertigung.
Viele Essen und Getränkestände.
Tolle Arena",12/19/2025 18:02:32,Marco Holtz,2025-12-19 18:02:32
Google,5,Increible recinto y ambiente. 5 estrellas sin duda,12/19/2025 02:47:57,Manuel Ivars,2025-12-19 02:47:57
Google,4,"Right in front of the train station.
Big, impressive arena.

Didn’t love the security attitude though felt a bit aggressive. One of them even commented, “I hate when artists do dumb shit like this.”
Attending a concert for your favorite artist and hearing that from arena staff wasn’t exactly on my bingo card.

So not my favorite arena, but overall still a good experience.",12/18/2025 22:32:12,Yuvi,2025-12-18 22:32:12
Google,1,"The staff is extremely rude and unaccommodating to disabled people. Example one, the employee outside of the venue just consistently scream “go all the way down! To the right to the right to the right!” Then you get inside and they are worse than TSA. You’ve got 4 different employees shouting 4 different directions at you at the same time. And you do not have enough plastic bowls and bins to pass get the amount of people through security in the amount of time you are trying to do it in. No where on you website does it say do not wear steel toed shoes, I had to go back and forth through the metal detectors and then take my boots off on the floor in the middle of the crowd trying to inside, made it through finally and then the employees were just snapping and yelling about getting my items from the bowl, and I had to try and put my boots back on again I’m in the middle of the walk way getting my fingers and belongings stepped on. It doesn’t end there, the people who scan the tickets are rude then you try to look at the artist merchandise for sale and you’ve got more employees screaming at you to move. The ONE THING those employees could do that would actually be useful is help people find their seats except the don’t, they just tell you if you are wrong but don’t help you find the right way. It’s up to all the paying attendees to help each other. Then by the time the event is over, you are getting screamed at once again by the employees “GET OUT GET OUT GO THIS WAY GET OUT!!!” Maybe don’t have exit signs up if you don’t want people to follow them? I don’t get it. Over all, the staff ruined my experience and I traveled all the way from Virginia Beach for this concert. Very rude, very ugly. I am a disabled adult with ASD and I have slow processing, having these employees hound me like I’m in bootcamp was not how I wanted to remember my night that I paid A LOT of money for. Ticket purchase through Ticketmaster is always terrible, you should use your own services, or a smaller company like brown paper tickets. Communication should be clear about no steel toe boots or you’ll have to take them off in advanced. This knowledge would be helpful to people. Unless you take the subway, the Barclay center is located at an extremely congested intersection, so commute and parking are awful. The event entertainment itself is great but the experience is ruined by the staff so what could have been a 10 out of 10 is now a 5 out of 10 rating because of the horrible staff.",12/18/2025 22:17:04,Alec Janus,2025-12-18 22:17:04
Google,3,Solid arena though a bit dark and dull too bad the nets are really trash right now,12/18/2025 19:07:55,Jo Lior,2025-12-18 19:07:55
Google,3,Venue is nice but makes you feel like you are squeezed in.,12/18/2025 07:26:22,Lite Skin,2025-12-18 07:26:22
Google,5,Such a modern arena! Amazing vibes,12/18/2025 00:21:37,Rafael,2025-12-18 00:21:37
Google,5,The two guys working the box office tonight were so lovely and I am so grateful for them,12/17/2025 22:09:10,N Hailparn,2025-12-17 22:09:10
Google,2,"Went for a concert. 8$ hotdog. They charge 7$ for a Pepsi, not even a Coke. Clean venue but sucks for concerts. Too much of a incline where seats are",12/17/2025 21:29:51,Jeff Rosa,2025-12-17 21:29:51
Google,5,Instalaciones increibles.,12/17/2025 18:54:32,Sandra Andreu,2025-12-17 18:54:32
Google,5,"Belle expérience et bon compromis si vous voulait allez voir un match de nba à défaut d’aller voir les knicks prix plus abordable, équipe moins forte , mais le barclays center est top bien équipé assez moderne et pas mal de food et store , assez facile en métro top je recommande",12/17/2025 11:17:42,Alan,2025-12-17 11:17:42
Google,1,"the most nonsensical security checks, they've made me take off my knee high boots, they've taken away my lighters, they have sold lighters as merch but only AFTER the show, and they won't use the ny state id app for the bar so what is the point of the app even existing? (and i'm not talking about a picture im talking about a scannable qr code app with all my details that has to have service to be accessed so it can be verified by the state.)  and the sound quality sucks. i love brooklyn, i hate this place as a concert venue.)",12/17/2025 00:16:58,Veronica R,2025-12-17 00:16:58
Google,5,"Ver un partido de la NBA es algo que todo el mundo tendría q vivir una vez en la vida! Incluso si no sabes de baloncesto o no es algo que te llame la atención, te lo recomiendo es todo un espectáculo! Cada descanso había un espectáculo!",12/16/2025 14:44:53,Tamara Serrano,2025-12-16 14:44:53
Google,5,The Best McDonald Fries 🍟 Ever,12/16/2025 14:44:25,Tarik Washington,2025-12-16 14:44:25
Google,5,"Un'arena incredibile, una dimensione alla quale in Italia, e per la maggior parte in tutta Europa non siamo abituati. Posti di grande comodità, rapidità di ingresso ed uscita elevata, e godi di una vista eccellente da qualsiasi posizione. Io sono stato ad alcune partite dei Nets e lo spettacolo al di là del basket è garantito da musica ed altre iniziative che tengono incollati al seggiolino per tutto il tempo. Impianto sonoro top level. Direi da sogno.",12/16/2025 08:13:44,Romano Petitti,2025-12-16 08:13:44
Google,5,"Awesome concert experience!
Every seat is a winner. The sound system just blows you away!!!",12/15/2025 17:13:10,Mike P,2025-12-15 17:13:10
Google,5,Had a blast at the boy is mine  concert,12/15/2025 15:52:43,Dana Phillips,2025-12-15 15:52:43
Google,4,"Came here to watch a Brooklyn Nets game. Barclays Center is a very nice arena—modern, clean, and well laid out—with a good amount of food and drink options throughout the venue.

The staff was friendly overall, but they were clearly required to follow some very strict rules when it came to drinks. I ordered a whiskey neat and was told they had to add a few ice cubes. At one point, my wife was holding both my drink and hers while I went to the bathroom, and a staff member stopped her and said he would make her pour it out unless he saw me come back. He actually waited until I returned. I’ve never experienced that at any game before, so it was pretty surprising—maybe they’ve had issues in the past.

The vibe in the arena felt a bit low, and it didn’t seem like there were many fans there, which could be because the team isn’t playing particularly well right now. Still, the arena itself is solid and well run, just be prepared for very strict drink policies.",12/15/2025 03:30:06,Kevin Drost,2025-12-15 03:30:06
Google,5,Great place for venues. Nets games are always fun. Plenty of food options. The staff were friendly and helpful.,12/14/2025 22:52:53,meir bamberger,2025-12-14 22:52:53
Google,5,Qualité prix super bien ! Belle activité pour voyage de couple à New York,12/14/2025 15:21:56,Dravit.M340,2025-12-14 15:21:56
Google,5,"I forgot to ask for her name but the one who was giving out tickets for the Christian Nodal concert.Hispanic,short curly hair about 5ft very nice she was so helpful in finding me(the lost friend of the 3) 🤣🤣🤣 God bless her excellent customer service!",12/14/2025 13:41:23,Lexie BEE,2025-12-14 13:41:23
Google,1,"Three days later, and my face is still swollen. The tools were so dirty, and rusty",12/14/2025 11:48:32,Ebony Merritt,2025-12-14 11:48:32
Google,5,Great place for sports or concerts.,12/14/2025 07:57:04,Timothy Wolfe,2025-12-14 07:57:04
Google,4,I was trying to get to a suite  I asked  someone that works there They kept sending me in different directions,12/14/2025 00:06:42,Mike Nunez,2025-12-14 00:06:42
Google,5,"雖然籃網沒有獲勝，有看到球員的努力，連續投進三分球拉進比分，讓對手喊了幾次暫停，可能嚇到了，哈哈。
球場氛圍很好，剛好坐的位置有拿到氣球棒，當然要幫忙干擾對手囉！希望下次可以拿到投射的球衣 💪",12/13/2025 06:39:42,HsiangYu Chang,2025-12-13 06:39:42
Google,5,Went on a field trip - seeing behind the scenes and getting access to normally non-public places was awesome!,12/13/2025 00:16:45,Lisa Nitzsche,2025-12-13 00:16:45
Google,5,Great location. 2nd time there,12/12/2025 14:16:56,Maria Rose,2025-12-12 14:16:56
Google,5,"Tima experiência,  valeu a pena",12/11/2025 15:48:24,Andrea Guerra Gomes de Sousa,2025-12-11 15:48:24
Google,5,"I went there to see peso pluma perform. This is one of the greatest concerts I’ve been too. Barclays center is definitely top 3 best arenas in nyc.
The place is big and outstanding. From entering the place you will see the magic.
Concert was lit and excellent. I’d definitely come back to this stadium to see more performances.",12/11/2025 09:44:57,Kevin,2025-12-11 09:44:57
Google,5,Came to Barclays on 10/28 to see Tame Impala. This is an awesome venue with great staff and easy to get to with the subway. The show was absolutely incredible!!,12/09/2025 15:59:55,Jen Gold,2025-12-09 15:59:55
Google,5,"Ya que fui a Nueva York quise tener la experiencia de ver un partido de la NBA, merece la pena, porque es un espectáculo y aunque no te guste el baloncesto va a mover todos tus emociones y por lo que va a merecer la pena, el personal de todo el estadio muy amable. Hay internet gratuito que te permite pasar las entradas en caso de que no tengas Internet, porque las entradas al comprarlas online son unas entradas con un cifrado especial que necesita Internet. Yo estuve en la sección 110 y se ve perfectamente.",12/09/2025 12:19:06,Jose Manuel Carrasco,2025-12-09 12:19:06
Google,5,"Awesome, especially the subway drops you off right in front.And then you get back on the subway and go straight back to grand central",12/09/2025 08:13:22,Ali Del (Ali),2025-12-09 08:13:22
Google,5,"Nets is Soso, but fun place",12/09/2025 01:15:37,Terry Sun,2025-12-09 01:15:37
Google,5,"Went to Barclays Center on Nov19 2025 for the STEVIE NICKS CONCERT✨. Parked in a nearby underground parking garage and it was very easy to get to. The center itself was simple to navigate and the concessions prices were not through the roof as one would expect. Great views of the stage, even from farther away. Exiting the arena after the show was swift and went better than expected. And Stevie of course, was OUTSTANDING!❤️",12/09/2025 01:08:22,Shield Maiden,2025-12-09 01:08:22
Google,4,Really liked Barclays Center. Getting in and out was really really easy. Lots of security and plenty of parking around the stadium. The only issue I saw was that the seat are way too small and moving in and out is obnoxious.,12/08/2025 17:06:42,Abdulrezzak Idilov,2025-12-08 17:06:42
Google,5,Siamo stati al Barclays center per una partita NBA Brooklyn Nets- Utah Jazz .. è un palazzetto attrezzatissimo e moderno facilmente raggiungibile con la metro D che ferma proprio davanti. Dentro si trova cibo da asporto da portare sugli spalti ed è un'esperienza che vale davvero la pena di fare. Musica e balli di crew hip hop negli intervalli rendono l atmosfera molto coinvolgente.,12/08/2025 15:12:14,Monia Maggini,2025-12-08 15:12:14
Google,2,"It’s a good venue for watching NY Liberty games, but the sound for concerts is terrible. Food choices leave much to be desired, and the parking situation is trash.",12/07/2025 23:10:12,Lisa Kretschman,2025-12-07 23:10:12
Google,4,"Très beau complexe sportif. Proche des stations de métro, on y vient sans soucis.

Les places sont très bien réparties sur plusieurs niveaux et même en hauteur la visibilité est parfaite.",12/07/2025 20:22:54,Crash Test,2025-12-07 20:22:54
Google,4,una spettacolo nella spettacolo . esperienza consigliata,12/07/2025 17:04:29,Stefania Salerno,2025-12-07 17:04:29
Google,5,Great spot to see an event. Close to the subway system so easy to get to from Manhattan. We arrived and with Clear were able to get in through a separate entrance in a timely manner. Staff was helpful getting us to our seats.,12/07/2025 13:40:07,Adriana B,2025-12-07 13:40:07
Google,5,"Un estadio de primer nivel, te revisan en la entrada, no llevar alimentos, así como en cualquier evento deportivo. Cuenta con muchas opciones para comprar artículos deportivos una vez dentro del estadio. Evita traer bolsas o mochilas grandes",12/06/2025 23:55:06,Elizabeth Villalobos,2025-12-06 23:55:06
Google,5,Home of my Brooklyn nets. Great stadium with great food,12/06/2025 23:49:37,Eli,2025-12-06 23:49:37
Google,4,"I love this place, you'll love it too once you know where to sit  during concerts.",12/06/2025 11:14:19,Lady Brown,2025-12-06 11:14:19
Google,5,"Una parada obligatoria si visitas Brooklyn. El Barclays Center no solo tiene una arquitectura exterior impresionante, sino que la logística para entrar y salir es excelente gracias a la conexión con Atlantic Terminal. El estadio es moderno, limpio y la acústica es muy buena. Incluso en las secciones altas se disfruta de una gran visibilidad. ¡Totalmente recomendado para vivir la energía de Nueva York!""",12/05/2025 22:54:48,Bayron Calderon,2025-12-05 22:54:48
Google,1,Very disappointed on our holiday to New York. We were really looking forward to watching the Nets and had a great first half until it was ruined and we were threatened to be kicked out. We enter the Barclay’s Center and went to the bar to grab a drink before the game with no issues as we provided our UK driving license ID. When half time comes around we go to another bar to be served a second drink however were refused due to not having our UK passports with us or US Driving license ? We explained we got served earlier and he said this should not have happened? We then go to another bar to see if this is correct and the guy at the other bar was going to serve us with our UK driving license. We then had security called to us and were threatened to be kicked out if we do this again even though we had valid UK driving license and are 26 years old. Why would we take our passport out? This was not specified before we visited. Completely ruined the night being threatened to be kicked out. Won’t be coming again. Staff are awful.,12/05/2025 21:41:09,Molly Burns,2025-12-05 21:41:09
Google,5,"Un lugar muy acogedor, hay parqueo a los alrededores..",12/05/2025 12:52:16,Minor Garcia,2025-12-05 12:52:16
Google,5,Très bonne ambiance je me suis régalé je recommande,12/04/2025 23:55:10,Francisco Neotoit,2025-12-04 23:55:10
Google,5,"Wir waren zum Spiel der Nets hier mit super Karten in der 6. Reihe mittig.
Die Arena ist wirklich beeindruckend und es war ein geiler Spiel!
Erschrocken habe ich mich über die Preise vor Ort für Speis und Trunk- aber damit muss man wohl rechnen.",12/03/2025 14:17:55,Marco Bonin,2025-12-03 14:17:55
Google,3,"Went with friends for a Nets game. Good energy from the staff. Very welcoming! Game good and entertainment.
The section we sat in great price on tickets but the seats not comfortable. Not enough leg room.",12/03/2025 12:36:35,Nicole F,2025-12-03 12:36:35
Google,5,"Comfortable seats, lots of food options and even seats up high provide a good view of the court.",12/03/2025 07:42:58,Ron Fulop,2025-12-03 07:42:58
Google,4,Drinks are too expensive. Be prepared to pay more for drinks than your ticket,12/03/2025 05:55:24,David Rowsey,2025-12-03 05:55:24
Google,5,I liked my experience here.,12/02/2025 17:22:18,Layla Foster,2025-12-02 17:22:18
Google,5,"Went for an NBA game with two new friends — complimentary VIP suite tickets for the Brooklyn Nets vs. Boston Celtics. The first half felt like warming up, but the later half turned fiery, the whole arena pulsing with energy.

Instead of grabbing a drink afterwards, we made a spontaneous decision: walk the Brooklyn Bridge at night. My first time. And somehow magical. The skyline shimmering, the wind cold but comforting, and the city unfolding quietly beneath us.

Funny how life arranges its timing — I tried crossing on July 4th but it was closed for fireworks. Yet tonight, without planning, it opened itself to me in its own way. Some moments are meant to find you when you’re not looking.",12/02/2025 05:57:19,Kenneth Wong,2025-12-02 05:57:19
Google,5,"⭐⭐⭐⭐⭐ Absolutely unforgettable night at Barclays Center!
Seeing Hong Kong legends G.E.M. (鄧紫棋) and David Tao (陶喆) share the stage was a dream come true for any Mandarin pop and R&B fan. G.E.M. brought her insane vocal power and infectious energy – those high notes in “光年之外” and “泡沫” literally gave the entire arena chills. Then David Tao, the godfather of Chinese R&B, came out with that smooth, soulful voice on classics like “愛很簡單”, “黑色柳丁”, and of course “Melody” – the crowd was singing every single word.
The production was top-tier: crystal-clear sound, stunning visuals, and the lighting perfectly matched the emotional vibe of every song. Barclays Center’s acoustics made G.E.M.’s belts and David Tao’s silky runs sound even better than on the albums.
Easily one of the best concerts I’ve ever attended in NYC. If these two ever tour again, I’m buying tickets the second they drop. Thank you Barclays Center for hosting this historic night – 1000/10 would relive it again! 🔥🎤
And a new Molly tea location",12/02/2025 03:35:41,。,2025-12-02 03:35:41
Google,4,Excellent service overall.,12/01/2025 21:56:06,Margaretlz Dnvika,2025-12-01 21:56:06
Google,4,"Easily accessibe by subway. Paid and street parking available within 10 min walk.
BEWARE: if your tickets indicate SRO next to seat number, that means you DON’T have a seat. That is Standing Room Only.",12/01/2025 14:06:35,Zoran Lazarevic,2025-12-01 14:06:35
Google,1,They will sell you a bottle of water at $7 and refuse to give you the cap “for safety reasons”.,11/30/2025 23:43:25,Paul Zhang,2025-11-30 23:43:25
Google,5,"Barclays Center je sodobna večnamenska dvorana v soseski Prospect Heights v Brooklynu in eno osrednjih prizorišč za šport, glasbo in velike prireditve v New Yorku. Odprta je bila leta 2012 in je znana po svoji prepoznavni temni fasadi iz jeklenih panelov ter vpadljivi zasnovi.

Je domača dvorana NBA ekipe Brooklyn Nets.

Sprejme približno 17.000 obiskovalcev pri košarki in še več pri koncertih.

V notranjosti ponuja udobna sedišča, odlično akustiko ter bogato ponudbo hrane in pijače.

Gostuje največje glasbene zvezde, boksarske dvoboje, wrestling dogodke in kulturne festivale.

Zaradi svoje lokacije nad pomembnim prometnim vozliščem je zelo dostopen z metrojem.

Barclays Center je sodobno, živahno in arhitekturno zanimivo prizorišče, ki velja za enega najpomembnejših kulturno-športnih centrov v New Yorku.

Ogledal sem si košarkarsko tekmo med  ekipama Brooklyn ( Dragič ) : Dallas ( Dončič )
Nepozabno doživetje, ostalo mi bo  v večnem spominu! 😅👍👏🙏",11/30/2025 20:20:54,Robert,2025-11-30 20:20:54
Google,3,"The game was fun and atmosphere was electric! However, you’ll be paying a pretty penny for mid food. I paid 13$ for jerk chicken tacos and the tortillas weren’t even cooked 😡",11/30/2025 15:46:32,Karelis Dejesus,2025-11-30 15:46:32
Google,1,HORRENDOUS HORRIBLE EXPERIENCE… I WAS ROBBED HERE OF MY BURBERRY SCARF of the back of my chair while watching a basketball game I was mortified so upset while on holiday robbed of my belongs here.. and the staff couldn’t care less one of them told me to stop crying as I was very shaken that sombody had took my belongs right behind me then up and changed seats in the area… staff DID NOTHING so don’t expect them to help In any kind of way if you get robbed or in any kind of scary incident… ruined my holiday ruined my experience missed the whole game worrying trying to work out what had happened… no care in the world or help to try fix it from the stars!!! Go elsewhere to watch sports games devastated!!!!!!? £500 Burberry scarf gone and felt violated just by sitting in a seat watching a game!! STAY AWAY!!!! UNSAFE NO HELP,11/30/2025 01:52:04,Larn Hardy,2025-11-30 01:52:04
Google,4,"The Nets are a buns team, but in terms of the arena Barclays doesn’t disappoint. The higher level seats are at a steep incline, so best to sit lower if heights aren’t your thing. Food and drink is colossally overpriced, so best to eat before the game/concert. Acoustics good and security generally friendly throughout. Merch stores etc could be improved though.",11/29/2025 00:26:22,Oliver Ellis,2025-11-29 00:26:22
Google,5,"Great location by several subway and bus stops. Easy to get in through security, lots of food & beverage vendors. But the prices are very high. I recommend that you eat outside before entering the Barclays.",11/28/2025 12:29:19,Delareen Kennedy,2025-11-28 12:29:19
Google,5,"Ótima estrutura, ótimo clima pra curtir um jogo dos Nets.",11/27/2025 23:50:23,Juliano Tíndaro,2025-11-27 23:50:23
Google,5,Very cool stadium! Loved my visit to see the nets! Shame no win!,11/27/2025 16:04:24,Jonathan Taylor,2025-11-27 16:04:24
Google,4,"Saw Stevie Nicks,  great show. Super clean venue.  200 section is very steep. Only problem I see .",11/26/2025 21:01:16,Rich Palazzotto,2025-11-26 21:01:16
Google,5,World class sporting arena. Not a bad seat. Heaps of food and drink options and easy to get to. Access in and out was easy and public toilets are clean.,11/26/2025 04:19:04,Steve Tee,2025-11-26 04:19:04
Google,5,Larger than expected facility with plenty of shows and events.,11/26/2025 00:39:03,mark antonio rodriguez,2025-11-26 00:39:03
Google,5,Increible haber podido disfrutar de la NBA en un pavellón así. Es una experiencia recomendable 100% conocer como viven el deporte en USA 🤩,11/25/2025 22:42:12,Mireieta __,2025-11-25 22:42:12
Google,4,Raw after SummerSlam 25,11/25/2025 19:02:59,Hel Lo,2025-11-25 19:02:59
Google,5,"I’m ashamed to say I live about 10 minutes from Barclays center and I only attended an event for the first time last week. I saw Stevie Nicks (epic!) with some friends and I was delighted by the venue. I thought a big stadium type venue would be a logistical nightmare but it’s very well designed to get a crowd in and out of very efficiently. The bathrooms are plentiful, well located and quite clean. Stevie Nicks must attract a lot of women so the lines at the bathroom were a little long but really not more than a 5 minute wait.

I can’t speak for what it’s like during a sporting event because I don’t really participate in those but if it’s as efficient as it was for us, it’s probably pretty great.",11/25/2025 15:34:45,Jen Fraenkel,2025-11-25 15:34:45
Google,5,"Muy bien señalizado interiormente, sin problema para encontrar el asiento. Además el personal es muy amable.",11/25/2025 12:55:48,David GP,2025-11-25 12:55:48
Google,5,We went to Barclays Center for a concert. It was incredible.,11/25/2025 03:17:35,Ingrid Bassallo,2025-11-25 03:17:35
Google,5,Fantástico estadio de basketball! Conexiones a todos los subtes de NYC,11/25/2025 03:14:24,Alejandro Paz,2025-11-25 03:14:24
Yelp,4,"I highly recommend coming here with friends and family. I went to many Knicks and Nets games. The only thing I really did not like was the seats. They are built small, and are not comfortable at all. For all the money that is being spent the least they could do is get bigger and more comfy seats for their loyal fans. I also enjoyed the drinks and food. Everything is affordable and greatly proportioned.",12/07/2025 19:31:54,Sean C.,2025-12-07 19:31:54
Yelp,3,"Recently visited Barclays for John Legends concert and I must say they improved their sound quality ! However the food and drinks options are seriously lacking! I actually liked their folding chair seating, however the facilities were filthy! The merch shop needs a revamp!",11/20/2025 15:28:58,Julie P.,2025-11-20 15:28:58
Yelp,2,"Why 2 stars? Because it was the definition of soul-less.     ---   ---   ---  Barclays Center was the third arena I visited in three nights and it was easily the worst. I was here (as a Cavs fan) for the Nets home opener and my main takeaway is that you would hardly even know you were in the Nets' arena when you're walking around the concourses. I covered every inch of the lower and upper levels and it felt like I was just in a generic arena that the Nets were borrowing for the night.  Where is the team spirit? Where are the murals? Where are the player faces? You have to really hunt them down to find them. And don't get me wrong: I know the Nets are a bad team as of this writing. They don't have many marketable players. But I've never visited a sports venue that felt more like a neutral site than this one.   Secondly, and probably even more important: getting into this arena was the hardest and most inefficient process I've ever experienced. I've now been to 17 arenas for either an NBA or NHL game and this easily ranks #17.  When we arrived at the building, gates had already been open for about 30 minutes, but it looks like about 20K people were all standing outside the main gate, waiting to be let in.   We eventually were led by an employee to follow them around the corner to a gate with fewer people in line. There were maybe 20ish people walking behind this woman, and when we got there, we found just as crazy of a line as all of the ones at the main entrance. Eventually, she took us around another corner, where we waited in a slightly less long line than the others. It took forever and a day to get inside and we had to rush to our seats just to see tip-off. I know it's Game One, but this was a trainwreck.  In addition, a couple other pet peeves:  1) This arena is designed similarly to Dallas and San Antonio, where being in the upper deck feels like you are incredibly far away from the court. There are other arenas where you feel much more on top of the action in the upper deck: Houston, Chicago and Utah come to mind.   2) All of these venues tend to not have a lot of room between each aisle, but I think this is the worst I've ever seen. Numerous people almost fell down trying to get from their seat to the aisle, throughout the night. There is virtually zero room to do this and I'm not sure how they didn't test this in the design.   Barclays is my 12th NBA arena to visit, and now I can say I've done it, but I'll never need to return. It's new-ish and clean, but that's about all I can say in the positive column about it.",11/08/2025 13:28:11,Brett N.,2025-11-08 13:28:11
Yelp,4,Came to see the Brooklyn Nets vs the Detroit Pistons and a great time was had. This arena is huge and has lots of various vendors offering different food dishes to enjoy during your entertainment.,11/08/2025 01:19:33,Marquese C.,2025-11-08 01:19:33
Yelp,4,"Saw Sleep Token here on September 22 , 2025. They were awesome and were able to have an amazing laser show onstage here at Barclays.  My seat in Section 218 didn't have much legroom but was ok. It was sold out show but only took about 10 minutes to get out after show. Even a bottle of water was like $6.50 though . They do have alcohol and cocktails and food if you want it.  Staff are helpful.",10/31/2025 18:48:23,Susan R.,2025-10-31 18:48:23
Yelp,4,"I've been to Barclays Center a few times, mostly for New York Liberty games, and it's hands down my favorite venue. There really isn't a bad seat in the house--every section feels comfortable with plenty of legroom and space.  There are lots of food and drink options inside (prices are steep, but it's New York, so no surprise there). The bars always have great signature drinks, and the big merchandise store is a nice bonus.  Security is smooth, especially if you don't have a bag because there's a separate line that moves quickly. The staff is always friendly and welcoming, and I love that they thank you as you leave.  Restrooms are easy to find, and if you don't want to eat inside, there are plenty of restaurants right outside. There are a few parking lots within walking distance should you decide to drive over.   Barclays Center always gives a great experience--comfortable, organized, and full of good vibes!",10/29/2025 19:59:52,Kenya M.,2025-10-29 19:59:52
Yelp,5,"The improvements are remarkable, both visually and acoustically. Our team thoroughly enjoyed the experience. We sampled a variety of culinary offerings, all of which were exceptional. I highly recommend visiting the American Express Store for its unique merchandise.",10/23/2025 23:42:48,Sarah M.,2025-10-23 23:42:48
Yelp,3,"Good stadium in terms of seats, lighting and the show they put on. Went to go see boxing match there. Food is terrible and over priced.had the boneless wings and fries. Dry chicken. Service levels are hit and miss. Fast service at bathrooms and food and drink typically but staff are apathetic and appear to not give a damn at times.",10/20/2025 12:51:35,Tony J.,2025-10-20 12:51:35
Yelp,5,Great experience watching the WNBA game. (NYC Liberty vs. Chicago Sky)  I don't live in NYC so I traveled on the subway both ways.  Transportation was a piece of cake.  I was specifically impressed with everyone who works there.  Everyone was kind and professional.,10/06/2025 05:20:22,Denise A.,2025-10-06 05:20:22
Yelp,5,"my sister and I saw Charlixcx here in the spring and we had a great experience. the merch line was fast, and the bathrooms were clean and fast. the employees were great too because someone sat in our seats and they took care of it :)",09/23/2025 23:37:38,Abby M.,2025-09-23 23:37:38
Yelp,1,"I went to see Sleep Token at the Barclays center last night (9/22/25). The show itself was great, but I unfortunately left with a bad taste of the arena itself.   Before the show, my husband and I stopped at a snack stand. The price screen showed that a regular soda was $7.75 and a souvenir cup was $9. We decided to buy one souvenir cup to share.   The snack stand had Mashgin automated check outs, so we placed the cup on the sensor and the price came up to $12.75 plus tax. I was confused-- the screen says souvenir cups are $9- so I asked for clarification from the gentleman working.  He informed me that the price on the screen was for ""Liberty Souvenir cups"" which aren't sold during concerts. I was a bit frustrated because if that's the case, then the screen shouldn't say $9, but decided to pay for it anyway. Also, the cup I received was a hard plastic""Brooklyn"" branded cup-- so feels very souvenir cup? Why are we adding $3 because it's a concert? But whatever...   As I was tapping my card to the screen, a second drink for $8 appeared on the check out screen for no apparent reason. A very nice older lady who was working there tried to stop me before I paid, but my card had already processed a transaction for $22.56.   I was upset because I was NOT planning on spending that much for a drink, but in an attempt to soften the blow and not deal with a lengthy refund process, I asked the nice older lady if I could just get a second drink since I paid for it.   She brought one over from the cooler and a younger lady behind the counter immediately had an attitude. She asked why I was getting a second drink to which we explained the situation. She aggressively asked if I had a receipt, which I did not, because one was not printed. She got on the phone with a huff and asked me to wait for her supervisor to arrive. I pulled up my bank statement in the meantime to show that I was in fact charged $22.56 and she just rolled her eyes and said ""wait"". I waited about 10 minutes and no one showed up. Eventually she looked at the gentleman from before and said ""just pour it"".   So not only was I overcharged for an item that displayed a different price, but I was charged for a drink that I very obviously didn't have on the sensor AND then I'm given attitude because I didn't want to be out an extra $8 for no reason. Like these items are already outrageously priced ($8 for a 20oz bottles worth?) just let me get what I paid for.   To top it off, my husband ended up getting a pretzel while we were waiting that was rock solid and very dry, so not worth the $8 for that either.",09/23/2025 16:30:11,Ashley F.,2025-09-23 16:30:11
Yelp,2,"Drinks are overpriced, a particular female employee was rude. Ok, so I missed the part about not being able to bring a lighter with me. I asked if I could get it back after the show she said no. I wanted it back but she would allow me to go back out once I entered. So my 30 dollar lighter I'm sure is being enjoyed by the staff. I'd like to add the fact the they also said no smoking or vaping allowed. Well I got news for you. I smelled cigarettes, and definitely saw at least 2 people vaping in front of us. My motive was to enjoy my cigar after the show, not smoke while inside (common sense).  My next complaint is not about the arena, but it's about the ""young adults"" in front of that spilled their drinks more than drinking it. They couldn't stay still and literally spoke through out the whole concert. I'm not sure why even go to a concert if you're just going to keep talking. Just my 2 cents. For me, MSG will always be better. And one last thing, the sound of the concert sucked. Performance was great but the sound system sucks.",09/21/2025 17:05:16,Jeff L.,2025-09-21 17:05:16
Yelp,5,"I'm a WNBA fan through and through. As a lady basketball player, I want to support women's sports. While my home team is Las Vegas Aces, that doesn't stop me from traveling to other cities to see their team compete.   I always here how hype the NY crowd is at the Liberty games and decided to check it out for myself and even moreso that Natasha Cloud is on the team.   There are several entrances to get in but you must go in the entrance for your section. That can be good and bad depending how much walking you can do comfortably. I recently injured my foot, so it was a lot of walking. The staff were actually friendly. I wasn't expecting this based on other reviews.   While the Liberty lost to the Sky, it was a good game, but I must admit that Ellie stole the show. Ellie has to be the hardest working mascot that I've seen across all sports.   I had a great time and wouldn't hesitate yo come back to another Liberty game.",09/14/2025 00:16:58,Tara H.,2025-09-14 00:16:58
Yelp,1,"The security at this venue is unnecessarily aggressive and hostile. They have a strict bag checking policy (which is valid considering the size of the place and the amount of people entering at once) but treat patrons as if they are going through a check point in a prison rather than a concert venue.  If your items aren't approved according to their policy, they are discarded against your will without any options to retrieve them after the show. You are met with rude and unprofessional staff, antagonizing remarks and  even threats of physical altercations initiated by someone checking your bag (who is supposed to be making the event secure?). The level of unprofessionalism exhibited  is completely unwarranted  and I hope for the sake of Barclays they do a more thorough investigation on the people they employ and the environment they create for paying costumers. Tickets for this venue aren't necessarily cheap and to be treated like an inmate for having a lighter in your bag by a security guard on a power trip is going to make this place go lose business very quickly.",09/04/2025 18:03:33,Jessica V.,2025-09-04 18:03:33
Yelp,3,"The venue is very hit or miss. If you're higher up, it's not so great. If you're in the wrong section, enjoy your uncomfortable seats.  Did not eat or drink here, so can't comment on that. Security is like the airport, get ready to empty your pockets.",09/03/2025 03:35:10,Tom T.,2025-09-03 03:35:10
Yelp,4,"I realized the Barclays can be a hit a miss, depending on what venue you are there for and who is preforming, I have been there to several  events, every venue experience was different. Mary J Blige entry was chaos, just get in where you fit in.  However, my latest visit to the NY Liberty game was a hit ! entry was effortless, clear concise entry and seating points. Once inside the venue the beverage and food prices was typical, I was lucky enough to find Pops Patties at $9.00 for a Jerk Chicken Pattie, it was reasonable price, ordering is through QR code and your name or number is called for pick up.  We did purchase overpriced merch and popcorn but the NY Liberty won and the halftime and in between time is a party.  Ellie the mascot, turned up ! It was so much fun! The Barclays is easily accessible by mass transit but if you are driving, get there early and be prepared to circle the block.",08/27/2025 23:15:07,Shonta H.,2025-08-27 23:15:07
Yelp,4,"While they don't have the legacy and fame of an MSG, you can say that this is the home of a defending NY pro-basketball team. You couldn't have uttered that sentence since 1972. For that reason alone, Barclays is a place to visit to watch a fun and family-friendly NY Liberty game. The steepness of the upper level seats used to give me a lot of anxiety, but recent visits to the arena in sections closer to the court has really changed my view on how great it is to watch a game here.  Crowds are generally great, building is clean, and the convenience of all subway lines converging at Atlantic Ave is quite perfect for commutes. The fact that events at Barclays are still somewhat affordable is great to see.",08/27/2025 05:05:57,Nelson W.,2025-08-27 05:05:57
Yelp,2,I've been here 4 or 5 times sitting in different areas and the sound is always terrible. You can't understand anything the artists are singing. Bass boom is inconsistent and a lot of echo. Coney Island sounds better and it's an open bandshell. Food and drink prices are too high. They need to see the prices in Atlanta Mercedes Benz stadium and see what should be the cost of it. Last time coming here anyway.,08/25/2025 01:13:11,Kevin H.,2025-08-25 01:13:11
Yelp,4,"Great venue for concerts. Train is right in front, staff is always nice here & multiple food options to have prior to shows. There are multiple restrooms always in good clean condition but crowded for sure. I love that no matter where you are seated you can see at this venue",08/08/2025 16:49:22,Natasha R.,2025-08-08 16:49:22
Yelp,4,"I saw my first concert at the Barclays back in 2013 - The National and Youth Lagoon.  My friend had an extra ticket and we sat in the nosebleeds. Sound was good and we enjoyed it. In 2014 I saw a Brooklyn Nets vs. Toronto Raptors game with some Canadian fans. I also saw Arcade Fire in 2014, which was amazing. However, I think the coolest event I've been to was ""The Nightmare Before Christmas"" film with live music from Danny Elfman, a full orchestra and cast members including Cathrine O'Hara in 2017. Barclays was also the hub of bus transportation to Manhattan during hurricane Sandy in 2012. Architecturally / construction wise, for those of us who worked nearby during the construction, it's took some time getting used to it - but ultimately is an amazing resource for the community. It's now become a landmark - I'll meet you at Barclays. I hope to attend more memorable events here again soon!",07/24/2025 18:12:23,Amanda H.,2025-07-24 18:12:23
Yelp,4,"Incredible Experience with Just One Small Tweak Needed  We attended the Tyler, the Creator concert at Barclays Center and had the pleasure of experiencing it from Row 1, Section 8 of JetBlue @ The Key and let me just say, the concert itself was 5 stars all the way. Tyler brought the energy, the stage design was electric, and the vibe was off the charts.  As for JetBlue @ The Key, it's easily one of the best ways to enjoy a concert at Barclays. The suite experience comes with a ton of perks that elevate the night beyond just a great seat. The seats themselves were extra comfortable, with a perfect view of the stage and butler service that delivered food and drinks right to us yes, seriously.  Inside the suite, you get:  Private restrooms (huge plus no lines!)  A cash bar  Complimentary food that, while not the most varied, was well-stocked throughout the night and definitely satisfying  Dedicated security and a peaceful atmosphere before and after the show  Access to a private lounge area that felt like a mini-VIP hangout  The only reason this is 4 stars and not 5 is the timing. Even with a premium ticket, they didn't allow early entry ahead of the general public the doors opened for everyone at 6:30pm. It would've made the experience even more exclusive and smooth if JetBlue @ The Key ticket holders were let in a bit earlier to relax and enjoy the suite.  That said, the overall experience was fantastic. Between the amazing concert, the front-row view, great service, and top-tier comfort, this is absolutely worth it if you're thinking about upgrading your event night. Highly recommend JetBlue @ The Key for your next big concert or game just hope they tweak that early access policy in the future.",07/21/2025 19:05:24,Diego P.,2025-07-21 19:05:24
Yelp,5,"Service is great & some of the food is good. But you may get lukewarm & when you get to your seat, the food is cold. Also, food is very expensive. They do have good basketball games there. I had section 3 row 14 and it was great seats.",07/14/2025 09:43:37,Rose H.,2025-07-14 09:43:37
Yelp,5,"First time visitor from SF .  Watched the WNBA Liberty team and was a wonderful experience , Friend was able to book tickets at a great price with military discount online.  Make sure you  download tickets to Wallet as WiFi spotty.   Merch store with a $5 discount with survey.  Scan a QR code by the cashier line.",07/02/2025 04:51:50,Jannette R.,2025-07-02 04:51:50
Yelp,1,"Something has to be done with the Barclays Center staff. Totally rude, unprofessional, hostile, miserable, and disrespectful staff. They behave like animals no manners whatsoever. The food is less then average and jacked up 75%, they have to do better all around. I will take my money and go to Madison Sq Garden or Yankee stadium that has some decent food. The staff also locked up the beverage half way through the show, i have Diabetes and needed sugar to stay alive, they laughed in my face when i told them that. Horrible experience it felt Humiliating, makes me never want to come back. Ghetto staff doesn't want to work but want to be paid. They should work at a correctional facility or do sensitivity training. If i can put zero stars i would, they deserve less then nothing. The ambiance was terrible all around, All the staff kept getting rude, loud, and angry with concert goers and ruined a Cherished experience for many what was supposed to be a positive experience turned nasty and bad. Do better.",05/26/2025 11:16:00,Keven C.,2025-05-26 11:16:00
Yelp,5,Wow this is a great venue for a concert. Check in through security was easy and the concourse was big enough. The venue has a good sound system. I would go here again if one of my artists that I like play here again.,05/07/2025 17:35:49,Michael O.,2025-05-07 17:35:49
Yelp,1,"Very disappointed with the Security Staff at the Barclay Center! My friend & I went out to smoke and when we went back in our bags were physically searched...even though the women that went in before & after that just had their bags put through the x-ray machine....which is not the issue. The issue is that they found a lighter in my friend's bag...THAT SHE GOT INTO AT THE EVENT....and they wanted to take it from her. Security removed it from her bag...my friend said it's ok we are going to leave now and took the lighter back. Security proceeded to say "" B***h if you touch that lighter, I will slap you"" and then threatened that she would be waiting for my friend outside when she got off work. This was extremely uncalled for. Management would not give their names for us to write a complaint & she did absolutely nothing about what had happened. We missed the whole end of the event & wasted $160 tickets. I have tried to reach out to Barclay's numerous times to file a complaint but no response. Do better when hiring your security staff & with training Barclay's...it is totally unacceptable the way we were treated. They even made me wait outside in the cold when I had nothing to do with the situation while waiting for the Manager.",05/05/2025 17:00:09,Kristin P.,2025-05-05 17:00:09
Yelp,5,"Great indoor venue for games and concerts  Been here for both kinds of events before, very nice and clean facilities  Staff are also friendly and helpful.",05/05/2025 15:23:11,Aaron Y.,2025-05-05 15:23:11
Yelp,5,"I've been to countless concerts and Nets games at the Barclays Center. Security and staff are always friendly and diligent, which I appreciate. Drinks and food are pricey but most arenas are. I love the space, and will continue choosing Barclays as my preferred concert venue",04/28/2025 22:45:04,Evita N.,2025-04-28 22:45:04
Yelp,4,"Barclays is a super fun stadium out in BK that screams old school hip hop. Renowned for selling out shows to the likes of JZ and the Notorious B.I.G., the Nets incorporate that vibe into their basketball games. I've also seen a fun monster truck rally here.  Pretty much any seat is a good seat and depending on which team is in town, it's fairly reasonable to snag tickets. I truly prefer this stadium over MSG and visibility is substantially better. The food is also decent with all the classics.",04/16/2025 20:50:00,Taylee M.,2025-04-16 20:50:00
Yelp,2,"Boy, has TD Garden spoiled me. This was honestly one of the worst basketball game experiences I've had, and I'm counting a few noncompetitive high school varsity games I witnessed from the comfort of a stuffy gymnasium. My top-tier chum who literally went to the school of hospitality and I came here on Friday for the Nets/Clippers game. We'd gotten free tickets in a really good location - row 10 behind the visitors' bench. It seemed like an especially ideal spot because (spoiler alert) the Nets are not good at all right now, so the best players to witness were very likely going to be on that aforementioned bench.  This got off to a rough start immediately. We had access to a VIP-ish entrance in the back of the arena on Dean Street, which definitely had fewer people than the main entry point, but still had a wait of about 10 to 15 minutes since we were a little late (I think we showed up around 7:25pm, so within just a few minutes of tip). I was coming directly from work and had a larger messenger bag with me. When we got to the security checkpoint, I was told by the guard that I had to go to a completely different line that had an X-ray scanner because of the size of my bag. Really frustrating (and the customer service was abysmal - instead of apologizing for the disconnect, etc., this guy just sullenly pointed in the general direction of another line and tersely said, ""Different line."") and there is absolutely NO signage anywhere in this area to guide patrons to the correct/appropriate lines for this issue. An incredibly easy fix and there's no excuse for it. That extended our overall wait time by another five or 10 minutes - thankfully the crowd was thinning out or this would have been even more annoying. In contrast, the TD Garden security situation is a breeze and has never taken me more than two minutes to get through.  A huge factor in the equation here - and it really can't be emphasized enough - is that the Brooklyn Nets are pretty atrocious right now. Without looking at the standings, I can't imagine there are more than two or three teams with a worse record, and it's reflected in the lack of name recognition (I consider myself a pretty engaged fan of professional sports and I could only name two players in the starting lineup), as well as the lackluster environment overall. I've been to my share of games in all four major US professional sports - including some ROUGH situations with my beloved NY Mets between their 2000 World Series appearance and the emergence of Jose Reyes and David Wright - and this was about as mausoleum-esque as it gets. Keep in mind that this was a Friday night AND they were playing a legit playoff team in the LA Clippers. Just a rough vibe, and it's hard to know how much of that is about Barclays or the team specifically, or a combo. But it had a big impact. When there's an electricity in the crowd, you can really feel that and it dramatically improves the outing.   Another issue from my perspective is that it's just too dark and gloomy here. If memory serves, part of the pitch when they moved this franchise to Brooklyn was that they were really going to embrace the ""urban"" aspect of their surroundings, which was reflected in the color scheme of both the uniforms and the arena. But I think when you're literally surrounded by blacks and grays and little in the way of literal lighting, it's a tough vibe. How excited can a fanbase get if it feels like they're sitting in a movie theater?  One highlight for me personally was that we coincidentally ended up attending Drew Timme's NBA debut (a player I'm very familiar with as a Gonzaga fan), who's been toiling in the G League since going undrafted a few years ago. After an awkward start, he ended up with a double-double in his debut, a rarity. Very pleasing and because it's so quiet in the arena, we're pretty sure he heard me yell, ""United we zag!"" after he ended up at the foul line - literally the only perk of a non-electric atmosphere. Hopefully he sticks around because he has the gritty intangibles that should in theory make him a fan favorite.  The biggest selling point of this arena is that it's within a stone's throw of Park Slope and all of the great food/drink offerings that edgy neighborhood provides. That doesn't speak well of Barclays, unfortunately.",03/30/2025 12:25:54,Emma G.,2025-03-30 12:25:54
Yelp,5,One thing I remember about the Barclays center was the food. If you're constantly in a rush and forget to make dinner reservations don't worry the Barclays elevates their chicken tenders and fries to the next level. This time around I decided to give Fuku a shot and honestly the silky white cheese dipping sauce alone would make me return for the experience.  Asked around for ice cream and caught a juniors with a minimal line and i made the right choice with the red velvet cheesecake slice.   For drinks the Brooklyn Pilsner was a refreshing alternative but after the half the Brooklyn mule stole the show with a souvenir cup. Expect longer than average lines and a tight security clearance that puts TSA to shame. After you entered from a bodega in the corner to a beef patty and coco bread pick up was a pleasant Brooklyn surprise for a Monday night,03/11/2025 16:47:51,Gissell M.,2025-03-11 16:47:51
Yelp,1,"So let me make sure I have the straight. You confiscate my cigarette lighters at the door and then when I choose to bring them back to my car and re-enter, you refuse to return my property, telling me that once they are in the bin, we cannot return them. When I think about that after the fact, it seems like that should be illegal. Anyway, I got in my car, and went home. Screw the show, I am in no mood to see anything after this idiocy. You can go straight to hell. I will never set foot in this place again, unless maybe Jesus Christ or the Buddha are making an appearance. And even then I would have to think about it. Talk about overkill.",03/08/2025 01:23:07,Tony D.,2025-03-08 01:23:07
Yelp,3,"It's relatively clean and since the Nets generally stink, it's usually not too crowded so getting inside is pretty quick and inexpensive.  Lots of subway entrances and exits around as well.  Food obviously isn't cheap and lines are long though, so I'd recommend eating beforehand.  Just remember to be careful on what you bring.  I've seen the Nets and Globetrotters here (as well as a few other events) a few times and I've had lots of things confiscated at the security checkpoint.  Metal water bottles, bagels, etc. Don't bring outside food or water.",02/16/2025 19:03:32,Matthew W.,2025-02-16 19:03:32
Yelp,5,"I came to see Disney on ice (Frozen and Encanto) with my 4 year old and 4 month old and it was a great time. We did have to go around the block a couple of times to find street parking at 6:45pm on a weekday but there are parking garages ($$) if you can't find public parking. Upon arrival the check in process was pretty quick and everyone was very excited for us. We had seats in section 8 and it was a great view to the ice rink. We brought noise cancelling headphones for our 4 month old but in case you don't have , guest relations has some (they're one size fits all) for the exchange of your state ID. We ended up not needing the headphones, the noise was mild. My baby slept through most of it. My 4 year old on the other hand, loved it and honestly so did I - excellent show and performers. I don't know that I'd recommend for a kid smaller than 3 years old because it was around 2 hours long and it's hard for them to stay still.  For food , they had like 3 different stands with fast food, I chose paisanos burgers and went with the burgers , the line was very long. The burgers (not featured ) were eh and around $16 each , but it did the job of filling me up. I tried my daughter's chicken fingers and those were surprisingly really good- get those instead of the burger (spent $75 on our food). They also had several snack places opened and gift shops , we got my daughter some memorabilia (bubble machine $35, cup $18 ).   Overall, the venue is good , the show was awesome and I'd definitely recommend both. Do come prepared to spend $$$ money as it's not a cheap night out.",02/09/2025 06:47:05,Carla O.,2025-02-09 06:47:05
Yelp,4,"We attended the Chinese New Year event for the Brooklyn Nets VS the Sacramento Kings. The lines to get in were quick, the staff was helpful, and the entertainment was amazing. We didn't get to try the food, but the atmosphere was amazing. Lots of team spirit for both teams. Thanks for a wonderful experience!!",02/08/2025 20:30:26,Karen N.,2025-02-08 20:30:26
Yelp,1,"Concert at Barkleys was like listening to a world class orchestra through a 2$ speaker. Save your money, this shitbox is not worth any of your money.",02/07/2025 04:13:57,Ronda W.,2025-02-07 04:13:57
Yelp,5,Great atmosphere! Great game time snacks and alcohol! Clean seats!  Courteous ushers. And the Celebs body guards didn't beat anyone up!! Love it there!,01/26/2025 22:25:19,Brandon A.,2025-01-26 22:25:19
Yelp,1,"Attended the Nets/Knicks game on 1/21/25 and decided to grab a burger and fries from the Kosher spot near sections 29-31. Unfortunately, the food was disappointing--the burger and fries were cold, and the middle of the burger was hard. I ended up throwing out the $21 meal.  To make matters worse, I had to leave the game at halftime due to severe stomach issues, which turned into full-blown food poisoning. I missed the rest of the week of work because of it.  Not sure if I'll return to Barclays Center anytime soon, but if I do, I'll definitely be avoiding that food stand.",01/26/2025 15:46:44,chris w.,2025-01-26 15:46:44
Yelp,1,It's 20 degrees outside. I'm waiting for my Uber and they won't let you stay inside!! Doubt I'll ever come here again!,01/20/2025 01:47:38,Alona P.,2025-01-20 01:47:38
Yelp,1,"The Barclays Center is great but unfortunately they partner with STUBHUB. STUBHUB IS THE WORST Here is one crooked scheme used. Stubhub lists tickets for sale, usually at a better than expected price. Customer purchases the tickets . Then the wrong tickets ( another date ) are electronically sent to the customer. All the customer see's is the Brooklyn Nets thinking they have the right tickets. You go to The Barclays Center on a Tuesday but have Thursday tickets in your hand. CHECK THE DATE - Stub Hub will offer you a refund and someone from Pakistan, Vietnam or Thailand will say, "" WE SO SORRY FOR YOUR INCONVENIENCE - WE WILL ISSUE YOU REFUND...OK "" NO it is not OK . STUBHUB is a racket a bad racket . There are other options , safer options . Purchase tickets at the Barclays Center the night you wish to attend an event",01/07/2025 22:15:13,Christopher G.,2025-01-07 22:15:13
Yelp,4,Won't lie- went to the Barclays center for a nets game today and their wings are official. I was 50/50 when they came out but NOT bad at all!! I was actually amazed how good they are.,01/07/2025 05:43:44,Angel A.,2025-01-07 05:43:44
Yelp,4,"I would say it is more of a 4.5. This was my first time at Barclays Center. It is a great venue to see a concert. We were lucky to have floor seats, row 5. The seats were great but I stood most of the time. The acoustics were amazing, as was the singer!!!  We were invited to the Qatar VIP Lounge. They had dedicated Mariah themed drinks for the evening, but you could really order whatever you like. The drinks were high quality and tasted awesome..The food was ok. I really liked the avocado toast. The avocado was fresh. The chicken was pretty good and the taquitos were meh. I would think for a VIP lounge for invited guests, the food could have been higher quality.   I would say the food is probably where they lose 1/2 a star, along with every other concert venue...not having enough Ladies bathrooms!! All in all, it seems like people all over the venue had a good view of the performer.",12/29/2024 05:39:17,Michelle F.,2024-12-29 05:39:17
Yelp,4,Great place to catch a game; this place must do some serious business as they had like 3 different games in one day. I was lucky enough to see my terps win over Syracuse. The one thing that really sucked was the fact at half time ALL the concession stands in the building seemed to be closed or as if they couldn't or wouldn't operate all of them - so the four that were open had lines out the door.   I have been to many sporting events all over the US and I've never experienced this.   Seats were awesome and the place is clean and visually appealing as well as right off the subway.,12/22/2024 14:54:18,Courtney E.,2024-12-22 14:54:18
Yelp,5,"I had a fantastic experience at The Barclays Center tonight. Moving thru security is like LGA but much faster and more friendlier. Once you get thru,  the place was moving and shaking, bars were on the left and right.   We found our seats quickly. I like the variety of locations available for wine and cocktails including Jay Z's upscale 40/40 Club and world famous Junior's Cheesecake. I'm also impressed because we had last minute seats in the 200 section. We could see the main stage. There are big screens and surround sound around the Barclays' so you definitely see and hear.   Parking garage  available but driving isn't necessary. This is one of the most accessible places in Brooklyn.  This is Downtown Brooklyn the LIRR, MTA trains and MTA buses are available into the evening.",12/14/2024 15:06:30,Letty C.,2024-12-14 15:06:30
Yelp,4,"Came here for the Brooklyn Nets basketball home game against the Orlando Magic. This is also part of the Nets: Kids Games series. Section 23 is a dedicated area for kiddos to play a series of video games to win prizes and can even get memorabilia- personally autographed by the players. Barclay itself is a circular maze with signage everywhere to pinpoint the section and row for your seats; it does get a bit hectic as the crowds gathered in the concession area; thankfully all staff personnel were really nice and helpful to direct us to our seats and even allow me to take pictures near center court. Concession food is super expensive (though, Glaze Donuts were giving complementary baked goods pre-game); Bathrooms were kept orderly and very clean and wait time was fast and quick. Overall, a really good experience for me and my kid.",12/02/2024 01:38:29,Mei C.,2024-12-02 01:38:29
Yelp,1,"Where do I start, extremely long lines, lack of organization. Waste of time, when people visit an event center, they are there to enjoy an experience. Thankfully there are other event centers with better management and customer service.  #UBS",11/18/2024 04:15:18,Keisha K.,2024-11-18 04:15:18
Yelp,1,"The service is terrible and the the seat guide was so grumpy that she looked like she was owed a million dollars. We accidentally sat one row forward because our seat number was deducted, and she rushed over and accused us of deliberately sitting forward. When we asked her what the correct seat was, she responded with ""you asked me?"" This made us feel very sad and angry. If we each spent $400 and were accused and wronged by the guide, then I hope she will do this to everyone until she is fired.",10/28/2024 07:55:13,以宁,2024-10-28 07:55:13
Yelp,1,"I am reviewing Tickmaster.com, not Barclays Center in Brooklyn.  This company is terrible. They do not take phone calls. Their phone support is manned by bunch of low paid workers.   They will not refund or credit you because event orginizer has a policy. Ticketmaster pretends not to know who event orginizer are.   In our case, Justin Timberlake showed up at 09:30PM, so 50,000 people were sitting and waiting from 7.30PM in their seats listening to DJ playing radio tunes from the 80s. Remember this.  Once again, Barclays is ok venue.  Ticketmaster is a low quality shitshow co peddling tickets.",10/09/2024 18:20:41,Gekaprog ..,2024-10-09 18:20:41
Yelp,4,Easy to get to from Long Island.   Lots to eat around area.  Great place steep seats up top.,10/07/2024 11:14:44,Al V.,2024-10-07 11:14:44
Yelp,5,"I have visited Barclays Center for several New York Nets and Liberty games in the previous years. The best times were during the Kevin Durant era with huge crowds and great games. I love the area and the vibe of being in Brooklyn. It is in a great location right by the two train. As soon as you leave the station you get to embrace the Brooklyn experience. There are several stores and restaurants nearby to hang out before the game. Day or night there is always something going on in this area.   The nice thing about going to games in the Barclays Center is that it is much easier and cheaper than going to MSG. You get to see your favorite opposing team for half the price that you would in Manhattan. Getting inside is quick and easy. My favorite part of the stadium is standing area in the first level. If you have tickets in the higher levels you can come down and watch the game without spending more money. There is usually a large crowd of people hanging out here so come by early if you want a front row view.  The food choices are great. You can go your typical Brooklyn route and get Junior's cheesecake which is a fan favorite. Fuku provides the spicy chicken sandwiches and fries. As with any stadium, food options here are expensive. Drinks can set you back $16 or so. It is highly recommended to come early and try out one of the local eateries and then attend the game.   The games are usually great. For the last couple of years the Nets have been doing well. The Liberty play during the summer season. It is always a great environment to watch a game. I went this past week to see the Liberty in the playoffs. I was able to see them win and go to the next round. They even had a half time show by Ja Rule. That was a throwback which I did not expect. You can usually find halftime shows by local rap artists here which is great.",10/06/2024 02:44:00,Tarun B.,2024-10-06 02:44:00
Yelp,1,I attended the Monster Truck Live Pre show which started at 10 am as well as the regular scheduled event for 1230. It was total chaos even before the doors opened. One staff member stated that all the doors would be opened so of course everyone started to separate to the additional entrances only to have another staff member state that only 2 doors were going to be used which caused a ton of confusion . Then the event was so UNORGANIZED that they confused VIP with the regular pre show attendees. The actual pre show was good for what it was. Now we are waiting for the arena to open so we can get our seats but of course people want food. The food vendors were not opened AT ALL even though they have an event scheduled for 10 am you would think they would make special arrangements to open the vendors a little earlier than 11 30. So now you have a rush of people waiting to get food and they were so unprepared. BROOKLYN BANGERS AND DOGS STAFF in the BARCLAYS CENTER were so RUDE AND NASTY. The pretzels were not done at all and they had a VERY LIMITED AMOUNT of hot dogs already prepared. Do better please. As expensive as everything is in that place you would at least expect GREAT CUSTOMER SERVICE AND ORGANIZATION,09/28/2024 20:27:18,Mardeana B.,2024-09-28 20:27:18
Yelp,1,"I bought three tickets for my children to the  Hot Wheels monster jam as part of a fundraiser for PS 321.  my brother offered to take my boys to the show so I transferred the tickets to him.  purchasing the tickets required me to download the Barclays app, Brooklyn Nets app and open a Ticketmaster account.  There was no way to print out the tickets and only one way to transfer them.  when my brother arrived at the arena, they wouldn't let them in because the transfer did not seem to have worked so they told him to go to the box office, but he got all the way onto the back end of the line to do it again I sent them to the show a half an hour early, but now it was Showtime I got on my bike in the rain to go down there to meet them and got them to the box office.  I showed them my proof of purchase. I showed them the effort to transfer them on the app. I showed them that the app showed it wasn't claimed, but then I showed them that it hadn't shown up on my brother's phone.  And the kid behind the desk said yeah there's nothing I can do.  You have to go over to Ticketmaster at number one.  So we stood in another line I kept saying isn't there a house manager who can put these boys in their seats? It's a school fundraiser. Nobody else is going to be in the seats. There are still tickets available.  It was like dealing with surly teenagers, blank expressions.  Then the new kid said go to box office number two.  My kids ended up missing half of the show and we only got in because I managed to get the app to reclaim the tickets through a workaround.  What do house managers do? what is the purpose of all these kids sitting behind the glass ticket booth if they can't solve a problem? zero problem at management.",09/28/2024 20:16:10,Cynthia M.,2024-09-28 20:16:10
Yelp,5,I've been to three different big concerts here and I'm never disappointed. The center is clean and the lines/crowds are well managed. I can usually sit and enjoy my show too. Not too shabby for a music venue.,09/24/2024 16:41:08,Ashley D.,2024-09-24 16:41:08
Yelp,4,"Barclays center is such a great venue! Over the past year, I've been to a concert, a liberty WNBA game, and a graduation ceremony! It's always been a great experience  Although, the food is so expensive - which is expected for stadiums, but I'm honestly always shocked at just how expensive it all is!   Ambience: it is a really fun environment for all these events!",09/24/2024 01:56:39,Dipali G.,2024-09-24 01:56:39
Yelp,5,"I went to see Usher at Barclays Center last week. Usher is an amazing singer and talented performer. His concert was everything. He performed a lot of his greatest hits and he even brought out some artists. He had Doug E. Fresh, Lil Kim and GloRilla perform. He even came down into the crowd and shared some moments with his fans. I would definitely go see Usher again. I'm glad that I was able to see him in my hometown Brooklyn, NY. Thank you Barclays for an amazing experience.",09/21/2024 14:21:03,Sherry S.,2024-09-21 14:21:03
Yelp,5,"Nice, new, modern arena. The inside is pretty dark, which is kind of cool. The paint is primarily black and dark gray. It kind of reminded me of a space ship. The inside of the arena felt a little smaller than I would have expected. However, holding 19,000 seats it's not really smaller than my home arena.   The women's bathrooms are kind of small although there did seem to be a good number of them. There were only 8 stalls in two of the bathrooms I went into. This isn't really enough for women, but they were clean and I saw people actively cleaning them.   Drinks for the concert I attended where pretty expensive, but it was to be expected. $16 for a single and $26 for a double. $18 for a premium single, $28 for a premium double. The pour was pretty heavy though.",09/11/2024 01:47:45,Stephanie S.,2024-09-11 01:47:45
Yelp,5,"You see peculiar things when you go to see the Liberty play at Barclays Center.  Men and women. Boys and girls. Old people (a number of the half-time dancers are seniors!) and young. Straight and gay. Friendly security guards. Movie stars. Sports icons. All sitting side by side.  And what are they doing? Just having a great time. Because a Liberty game is a rarity: a no judgement zone.  They held a 'Unity Night' in August, which I found odd, because every game the Liberty play in Barclays is a unity event.  No profanity. No ugly behavior. I have never seen an inebriated fan. The cursing and inappropriate behavior that has become ubiquitous at other New York professional sporting events does not occur at Liberty games. There isn't even any booing (unless a ref blows a call)!  Everyone is happy to be there, happy to be together. It's just a place to cheer and your team to victory.  And what a team! A New York team that really GETS New Yorkers. A tough team, with attitude, strength and an abundance of talent. A team consisting of players who pick one another up. A team that has yet to win a championship (but not, I am certain, for long).  And the place literally rocks. At times you would swear the building was shaking, especially when a Liberty player sinks a 3-pointer in a close game with little time remaining, then excitedly waves a victorious fist, exhorting the crowd as she runs down court.  Everyone standing and screaming deliriously at the top of their lungs in response.  That is when the arena starts spinning and the roof comes off and everyone is lifted up simultaneously, almost to the clouds.",09/10/2024 02:20:36,Philip Z.,2024-09-10 02:20:36
Yelp,5,"Saw Childish Gambino here last week. I have a fair amount of social anxiety, so large groups usually put me off.. but everyone working here was really nice and helpful. Even the security guard poking around my purse and examining my feminine care products for drugs, was lovely in her efficiency. XD  Also the show was amazing. I would absolutely come back.",09/05/2024 23:21:27,Margaret V.,2024-09-05 23:21:27
Yelp,5,Went to see a NY Liberty Basketball Game as I love to see an event at Barclays Center it's an awesome venue.  Unfortunately my freakin team lost .......,08/25/2024 01:37:08,Heather R.,2024-08-25 01:37:08
Yelp,4,Came here for a concert. We accessed a lot a block away which was a 2 minute walk. Nice newer looking building that is labeled easily to find seats. We used the American Express entrance that is on the side of the building. Took us 30 seconds on the line which was awesome. American Express users also get 10% off on food and drinks when using your card. Brooklyn Boardwalk is like Amazon Fresh. You swipe your card and walk out with want you want. The few employees we encountered were friendly and helpful. Good first experience here.,08/18/2024 13:04:40,Andrew I.,2024-08-18 13:04:40
Yelp,5,"Janet mf Jackson!!! Had amazing seats. The staff were all over the place providing assistance to everyone. The spot of clean.  The lines moved so quickly, and there was plenty of parking around the area. The concert started on time and I had the BEST time of my freaking life. I love me some Janet!!!",08/08/2024 21:44:41,Cynthia R.,2024-08-08 21:44:41
Yelp,5,I was here for a Brooklyn nets vs Lakers mach it was probably the best basketball game I went to in my life,08/05/2024 22:19:46,Bennett H.,2024-08-05 22:19:46
Yelp,3,"First of all, I think they built this place for the elves. seating is horrible. If you not  outside row seat or no seat in front of you gonna be hurting I'm only5'3 and my knees were killing me at games very very, very uncomfortable seating and positioning    food and it is expensive drinks expensive  be a fool.  trying to drink. I rather be drinking  before I get there.",07/13/2024 01:56:39,Lisa T.,2024-07-13 01:56:39
Yelp,3,Interesting venue. Went for a Chris brown concert. It's sad that they give you everything in a cup and can't even drink water from a bottle. Staff was a bit rude and didn't clarify policy. Food of course is overpriced. The tickets were also overpriced and the stage set up obstructed higher views. Limited space to stand and very steep. I'd rather fly out and go to a different basketball venue since it was so cramped with many problems. Even the technicians increased the music volume so it was difficult to hear the performer's vocals.,06/20/2024 16:00:49,Dimpie S.,2024-06-20 16:00:49
Yelp,5,I enjoyed my New York trip so much was able to go to the Barclays center. Take some pictures. Eat some pizza and do some shopping. Can't wait till I come back again. Had a wonderful time.,06/11/2024 23:58:20,Yesijnia J.,2024-06-11 23:58:20
Yelp,1,"Went to Nicki Minaj concert in May, lines outside were chaotic and disorganized. Once inside, ushers kept seating us incorrectly, despite the seats clearly marked, and one gave me attitude. concession overpriced, seats very cramped, feeling like you will fall over in to row in front of you.  Everyone smoking weed in their seats, I'm pro weed but it's a little much. Nothing really redeeming about the venu. Nicki herself was great though",06/09/2024 23:52:36,Anonymous C.,2024-06-09 23:52:36
Yelp,5,Barclays center is great I went to Friday night smackdown and Monday night raw and I met pat macaffe and Micheal Cole and others I saw the rock and Cody Rhodes making a surprise return and jey uso yeet here are some pictures and videos so 5 stars,05/25/2024 13:30:59,Matt S.,2024-05-25 13:30:59
Yelp,5,Heard so much about this historic attraction in New York. Needed to visit real quick. The atmosphere was busy on the street. Just did a nice drive-by to view this amazing historical place.,05/21/2024 12:49:08,De'ja M.,2024-05-21 12:49:08
Yelp,2,"Hi, I attended the NY Liberty game last night, Monday 5/20. I was seated in section 230. First off, I was deeply disappointed in the fact of it was only two concession options available on the 2nd floor. I decided on Nathan's, and I might as well have put on an employee name tag. Basically, I did everything from gathering the food to checking it out in ( I guess new) check out system.  Yet that same system had the Audacity to have a tip option appear on the screen as though I had been served. To than bite into what was clearly not a Nathan hot dog as well as a stale bun. My friend had the nachos and said he would have been better off putting cheese on an office depot box. It's totally unacceptable and outrageous considering the price point. 7 dollars for a bottle of water that you clearly got the water from the tap. You guys got a real racket going, and as a consumer, I want you to know it's disgusting....fix it!",05/21/2024 09:34:18,Nathan J.,2024-05-21 09:34:18
Yelp,1,"This place is terrible . Payed almost 2000 plus for front row . Had to wait in cold.  doors said open at seven didn't open til 830 900. Very disorganized people pushing no organization. Finally get inside almost two hours after 7 and the security didn't know how to tell us to get to our seats. No Bathroom near front row had to climb a mountain everytime had to go to bathroom . There was no difference in cheap seats to expensive. If u want to be bullied or feel unsafe going to the bathroom or concession go to Barclay . Security was no good! The seats in the front row all though u may be standing some, you are seated like sardines! Terrible expierience !",05/13/2024 20:55:47,MiSa G.,2024-05-13 20:55:47
Yelp,4,"I always wanted to visit but never knew one day at my son's graduation I will end up here. I was way to emotional to enjoy this place lol..! I was way to focus on my son & feeling overwhelmed with joy. This is probably one of my proudest moments in life, I am glad after all we had been through I got to see this day & he got to graduate with honors !   As a student government President he was seating on the stage & looking at him up there my eyes were getting foggy with tears. This kid went through a lot as a kid, there was a time I thought it will never come but it did. I am gonna stop now, time to review this place lol..!   This place is huge, lots of exit. Obviously crowded. We were lucky that my parents were here to visit this place & experience this proudest moments with us. They loved it. My mom keeps saying can't believe how organized & clean this place is. The country we are from she doesn't get to see this type of stadiums!   The security in the front could be better organized but I don't blame them ! They are overwhelmed & tired probably. It's not easy to work on a place like this.   Maybe one day I will come back to watch a game or concert. Then I will be able to fully enjoy this place. I was just too busy with the graduation",05/04/2024 16:42:57,Rezwana N.,2024-05-04 16:42:57
Yelp,1,"Attention: JEFF GEWIRTZ - STOP AAPI hate at Barclay Center!   JOEL LEVY, AGM, told me to reach out to you.    I'm Taiwanese American.  Went to a Lakers Nets game yesterday with my daughter.  At the end of the game with less than 5 minutes left, descended down to the lower level to exit and stood behind seats watching the final couple minutes along with 15 other fans.  One female Barclay usher told everyone that as long as we stand behind seats we are good.  3 minutes later, another male usher comes back and says everyone needs to leave.  He then comes only to my daughter and me out of the entire other group of fans (none of whom were Asian American) and up to my face asking   ""DO YOU SPEAK ENGLISH?""  Joel was right there and all he said was the employee apologized - NO HE DIDN'T.   Racist and discriminatory comments should not be tolerated.    JOE TSAI - DO BETTER and perhaps ensure that even folks (including my 12 year old daughter) of the same descent as you are not being subjected to and protected from conditions based on their race and national origin.  Appalling, disappointing and should not be tolerated.  Didn't pay hundreds of dollars to be treated like trash.  STOP AAPI hate.  Sorry but no longer think highly of you.    LAKERS org would never condone this.    Jeannie - give me a call.",04/01/2024 13:03:59,T D.,2024-04-01 13:03:59
Yelp,2,"Went for Sixers nets game. 'Security' is extremely rude. Even when in your section if you're invited up to see players and coaches during shoot around and are having conversation not bothering anyone they threaten to call security to throw you out. No one is even there yet and you're dampening the fan experience. I'm specifically talking about the lady at the bottom of section 115 while I was getting an autograph with one of the players with some other fans she tried to get my fiancé kicked out for waiting for me at the end of the aisle. Literally 100 people total in the building at the time. Very disheartening. Meanwhile, in section 115 people were seat hopping all over the place and not sitting in the seats they bought and no one batted an eye. Maybe should tighten up security there and leave the people alone who paid to be in the section who just want to get a closer look at their favorite players",03/06/2024 04:22:47,Jen F.,2024-03-06 04:22:47
Yelp,4,"My first time coming here was for a comedy show and we arrived early enough where it was not crowded at the entrance gate and walking to our seat was not overwhelming.  As we circled the walkway for our seat section and food, it felt like a mall, with different shops and brightly lit.  The seats were comfortable and we had a good viewing angle.  Would come here for events again.",02/23/2024 12:08:36,Jody S.,2024-02-23 12:08:36
Yelp,4,"Surprise trip to NY included a trip to Brooklyn to catch the Nets play. I know when you think of NYC you think of Madison Square Garden but let me tell you the Barclay's Center did not disappoint! Who knew you could purchase tickets that grants you access to a separate entrance (my friend and thank goodness he did lol). We entered at the Qatar Airways Entrance right next to the AMEX entrance. Yes, if you're an AMEX cardholder they have an entrance just for us! They offer complimentary drinks and give you 10% off if you choose to use your card at the concessions.   Upon entering we went upstairs to Suite Level A, where we were greeted with a few friendly faces. They asked for our tickets and then we were given wristbands. The wristband gave us access to the 40/40 Club (If you're thinking Jay-Z you're right lol). All you can eat food was included in the ticket price and I have to admit they provide a smorgasbord of food. There literally was something available for every type of eater you can think of. You also don't have to worry about standing in long lines to purchase your drinks, as there is a fully stocked bar on this level with friendly bartenders. I can't remember the young man's name, but he was funny and was most definitely pouring drinks lol.   After experiencing this level of exclusivity at an NBA game it will be very hard for me to go to a game and just sit in the ""regular seats"" paying for overpriced concession stand food and drinks. From now on I need a wristband and access to the Suite Level :).",02/22/2024 16:35:59,Domonique S.,2024-02-22 16:35:59
Yelp,2,"I've been here a number of times now for concerts, and I have to say, each experience was killing me a little more inside. The staff, specifically the security leading us inside,  do not know what they are doing. There were three of them giving people different instructions. Who were we supposed to listen to?  My latest visit was for a Chinese concert, Joker Xue, over the weekend. The concert was supposed to start at 8 pm, but by then, 80% of the fans were still standing outside in the cold, waiting to get inside the building. They were not utilizing the other entrances until 8:00 PM sharp. That is ridiculous. So many people missed the beginning of the show despite arriving early, like my husband and I. They were extremely disorganized, and that is very disrespectful to both the performer and the fans.  After finally getting inside, they were giving out the light sticks inside. But despite entering from the entrance directly in front of one of the staff handing them out, he said, ""No, where did you come from? I'm not giving this to you. Go around the building. They are handing it out by other entrances."" What the hell is that?",02/21/2024 14:50:36,Betty Y.,2024-02-21 14:50:36
Yelp,3,"The process to get inside is so disorganized when you are entering. And the staff is rude, ruining the experience before you even get inside. Every staff I've encountered while there seemed to be having a bad day or just tired. Who knows? It's just a snarky response to whatever you ask. And even when directing you, if you don't know, the interaction with the staff sn't pleasant. Besides that, There's lots of nice food selection. They have access to a nice custom jersey, and the chairs are comfortable, but overall, I enjoyed the game while I was there.",02/20/2024 13:57:07,Jenn M.,2024-02-20 13:57:07
Yelp,4,I went here to watch a nets game as a bucks fan. The staff was nice and the usher made sure we were welcome there. We didn't try any food but I noticed they didn't have too many food stands so that was a little different. The stadium is beautiful from the inside and outside and would definitely go back for a game.,02/18/2024 20:03:13,Mary S.,2024-02-18 20:03:13
Yelp,5,"Had fun watching THE LOX and a few others, the drinks were good and our seats were perfect, bathrooms are VERY CLEAN!!",02/10/2024 21:40:44,Patricia L.,2024-02-10 21:40:44
Yelp,2,"Barclays Center is a soulless pretentious arena that does little to respect the customer. It's like a very bad image using filters to clean up it's poor picture quality. From its inception this George Foreman grill like structure has bullied it's way into the Brooklyn landscape laying waste to neighborhood buildings and businesses.  It has carried it's obnoxiousness into the way it treats customers and patrons of this lackluster arena. I like many other Brooklynites were initially excited to have an arena where we can comfortably travel to, enjoy and return home in a matter of minutes. However, upon opening Barclays has revealed itself as nothing but a money grab pickpocket lacking in charm and beauty as opposed to the Kings Theater also in Brooklyn.   Barclays was designed like a modern American airbus. Take your money, give you little as possible, get you in and get you out as soon as possible. I recently stopped by the box office to purchase tickets to a Nets game. I have never have felt so unwelcomed! I knock on the locked door and a security guard rudely questions why I was there. I asked if this was the box office and she says ""yeah"" and reluctantly lets me in.  I had to go through a metal detector and offload all my belongings before even getting to the window to even buy the tickets!  Don't understand why since the place appeared empty with the exception of the rude guard and three people behind the desk. Two of which were having a conversation and looked up at me and then looked away and continued their conversation. The third ticket salesperson had a friendlier demeanor so I purchased the tickets from her. She was really helpful and assisted me in choosing great seats. If it hadn't been for the tickets being a gift for my son's birthday and the help I needed choosing the seating, I wouldn't have bothered stepping foot in there! Sometimes buying online doesn't give you a true depiction of the seating or space and a real tangible salesperson can assist you much better.   The arena on GameDay wasn't as terrible as I remembered it. I was there for the 1st Nets game ever played there and used to go frequently to Nets games and other events from music concerts to wrestling events. The concessions however are still abysmal and has poor traffic flow unlike MSG. You have a sardine in a can feeling traversing the hallways in search of food. The food options are quite limited for sporting events and you have to decide beforehand to either get food before the event or just miss half of the event waiting online to buy food. Then also shuffling through a crowd to get back to your seat. Take a wrong turn in Barclays and their is an obnoxious air of exclusivity by staff if you mistakenly  wander into the section for luxury boxes. Buying merch at Barclays for a Nets game is the same as purchasing food. Get it before the game, don't get it at all or miss the entire game trying to give them more of your money. Barclays doesn't make it convenient to do anything there. They just want you to shut up, give them your money and get the F out!",01/26/2024 23:58:33,Wayfit L.,2024-01-26 23:58:33
Yelp,4,"Went here for Brooklyn Nets game, got VIP tickets which included food. There were metal detectors when you entered. Space is very big and however the food was mediocre. The game was good, we got front row seats!",01/11/2024 15:24:23,Chin T.,2024-01-11 15:24:23
Yelp,4,"Came for a Knicks vs Nets game. The stadium is easily accessible from trains and there's lots of food in the area.   There were lots of different concession stands in the stadium that provided  various kinds of food. We saw they even have jerk chicken available. It was so cool. We didn't have any, but I would try it.  Our seats were good. We had a good view of the game and were not in the nosebleed seats.   Staff were nice. One staff member working the main entrance let us skip the line because we had kids with us.   4 stars. Solid venue.",01/09/2024 20:38:16,Lauren O.,2024-01-09 20:38:16
Google,5,I went to the Brandy and Monica concert. Venue was great. I had good seats. Nice venue!,11/23/2025 13:15:46,Shavonne Myles,2025-11-23 13:15:46
Google,5,"Very enjoyable experience to see a concert. Clean, well organized, nice restrooms!",11/23/2025 13:05:50,Tracy Jordan,2025-11-23 13:05:50
Google,5,Excellent venue. Not too big not too small just the right size. Seats are comfortable and the amenities are good.,11/23/2025 01:51:56,Andreas Katsouris,2025-11-23 01:51:56
Google,2,There's no reason on God's green earth that the floor is sticky before a concert.,11/22/2025 20:51:48,Christine “Yoshi” Gaines,2025-11-22 20:51:48
Google,5,"🇺🇸 🎤 Truly an excellent time, great organization of the Venue, Barclays Center is the place to go‼️ Stevie Nicks put on a excellent performance and the seating/sound system were second to none. Once again 2 thumbs up 👍🏻 👍🏻 for an all star quality show. Love you BROOKLYN 😎 Bay Ridges Own!",11/22/2025 19:22:29,Raymond Fialo,2025-11-22 19:22:29
Google,5,Clean and accessible venue,11/22/2025 16:48:43,David Schoen,2025-11-22 16:48:43
Google,4,"A great place to enjoy a concert, but very difficult to find parking.",11/22/2025 14:50:27,carlos sanchez,2025-11-22 14:50:27
Google,5,Had a great time at the Brandy Monica concert.,11/21/2025 21:02:17,Paul Patera,2025-11-21 21:02:17
Google,5,"Amo , es de mis lugares favoritos",11/21/2025 20:44:04,Anyely R,2025-11-21 20:44:04
Google,5,"Great place to spend many hours, so beautiful",11/21/2025 09:30:29,Sukheja Roshan,2025-11-21 09:30:29
Google,5,I come here for concerts all the time and I just love the fact I don’t have to go all the way to MSG in the city to have a good time. I recently went to Kaytranada concert and had a blast!,11/20/2025 17:03:47,theodore nellis,2025-11-20 17:03:47
Google,1,"Entering building for check in was not good. Look I had nothing dangerous but I did have my Stanley cup with ice only as I have low iron. Now the lady with braids already seemed she was not having a good day. She tells me I had to throw it away with saying I can leave it somewhere to pick later. I don’t understand there is an issue but it ok. She does not give clear instructions she was already loud and rude. I asked again can I leave it somewhere to pick up she said yes check it in I asked my sister to check as she crossed over. She yelled you can not do that needs to go to scanner I said no problem the she said you have to throw it away I said the ice I use it as my iron is low to chew. So if checked in and I feel unwell my sister can grab ice for me to chew. I mean no area to get ice without being on line. So I tossed the ice out and everyone saw and then a short black female told her more than once don’t argue she just kept being unprofessional. To a point I asked are you ok. She yelled at me to empty my pockets I said nothing is there she already yelled one at time no one did anything. Well I cross over. A tall black man with dreads was listening for a bit. The short black lady lies and says these two have an nasty attitude. Which wasn’t true cause my sister didn’t even talk. She just looked fyi the other lines not moving. Once we was with the tall black guy with dreads very nice guy. He said sorry we explained what happened I said look at the camera. Now  when I get to my seats the girl next to me a is like me and got hot slight faint thank goodness I carry ice packs which I put on her now if I had my ice medical team and a wheel chair would not be necessary . I think you guys need to figure out things for people who need certain things for a G-D forbid situation. We are human some can not take much heat some may have other situations. There is no reason to be that nasty and to lie be disrespectful  they don’t know everyone’s health issues. If they have this attitude, they do not belong to be in the public view or be within customer service field. Overall the place is amazing clean other staff was great they deserve the 5 star",11/20/2025 04:55:33,b k,2025-11-20 04:55:33
Google,5,"Toda una experiencia ver un partido de la NBA, no es la afición más animosa, pero vale la pena vivirlo",11/20/2025 01:20:08,José Manuel Martín Martín,2025-11-20 01:20:08
Google,5,"Went for a concert the other week, very organized and great experience! Great team working there.",11/19/2025 05:41:54,Eli,2025-11-19 05:41:54
Google,5,Went for a event in Events Center.  Gorg space .  Had a private Dinner.,11/18/2025 13:05:39,The Wine Suite LLC,2025-11-18 13:05:39
Google,5,"Saw the Kaytranada + Justice show.
Easy venue to navigate. Super accessible",11/17/2025 13:13:22,zachary hassan,2025-11-17 13:13:22
Google,1,"No es mi caso pero, si eres fumador, deja el o los mecheros en la calle a buen recaudo donde nadie te lo coja, que los de dentro te lo tiran por seguridad y no te los devuelven, no se entiende por qué no los dejan en una caja para ser devueltos. Partido al que vas, partido que te dejan sin mecheros, parece que los donan.",11/17/2025 02:18:02,Charlee Romero García,2025-11-17 02:18:02
Google,4,Typical indoor venue. Updated food and drink stations. Comfortable seating although narrow accessibility.,11/16/2025 17:14:27,Christopher McKee,2025-11-16 17:14:27
Google,4,looks like a boat but it a great addition to BK,11/16/2025 05:42:00,Aldo Bueno,2025-11-16 05:42:00
Google,5,"Went to my first Nets game last week, was impressed with how easy Barclays center was to get to. Felt like a very modern arena with all the necessary amenities and a bustling downtown area surrounding it. If only the Nets actually put up a fight in the game it would have been a perfect experience!",11/15/2025 20:54:50,Logan Hedrich,2025-11-15 20:54:50
Google,5,Amazing Time Impala concert,11/15/2025 19:35:10,Sabrina Delprat,2025-11-15 19:35:10
